{
  "kind": "domain_policy_pack",
  "version": "v1",
  "pack_id": "D2-physical.review",
  "domain_id": "D2-physical",
  "pack_type": "review",
  "rules": [
    {
      "rule_id": "D2-physical.review.default",
      "status": "active",
      "conditions": [
        {
          "action": "publish"
        }
      ],
      "effect": "review_required",
      "priority": 700
    }
  ],
  "default_effect": "review_required"
}
